{
  "schemaVersion": 1,
  "generationId": "gen-20260813T184709Z-154b4cf21379",
  "environmentId": "prod",
  "sourceKind": "openapi",
  "sourceFingerprint": "sha256:b8853f1d1d1b8e1a708cecf313c11eb3c5e0dbcbb434fa2c6ba7f28faa9bbfac",
  "previousHash": null,
  "currentHash": "sha256:800706b60e4b93fbadd00282f4c5359e67059400a7a4c0e62118af1e70cf03c6",
  "state": "committed",
  "createdAt": "2026-08-13T18:47:09.448Z",
  "committedAt": "2026-08-13T18:47:10.213Z",
  "artifacts": [
    {
      "role": "normalized-spec",
      "path": "orchestrator/api-contract/manifests/generation-artifacts/gen-20260813T184709Z-154b4cf21379/spec/openapi.json",
      "schemaVersion": 1,
      "size": 76753,
      "hash": "sha256:ee6af786faa6de20e1ea4d959619c4552d159084af8af289da05fa6b0024e275",
      "persistence": "committed",
      "required": true
    },
    {
      "role": "inventory",
      "path": "orchestrator/api-contract/manifests/generation-artifacts/gen-20260813T184709Z-154b4cf21379/endpoint-inventory.json",
      "schemaVersion": 1,
      "size": 31890,
      "hash": "sha256:800706b60e4b93fbadd00282f4c5359e67059400a7a4c0e62118af1e70cf03c6",
      "persistence": "committed",
      "required": true
    },
    {
      "role": "area:admin",
      "path": "orchestrator/api-contract/manifests/generation-artifacts/gen-20260813T184709Z-154b4cf21379/areas/admin.json",
      "schemaVersion": 1,
      "size": 41228,
      "hash": "sha256:c4ef973a7ba9abffa001eda410f053ce5658bee27f3d91d2b6bbc03fad10a1f9",
      "persistence": "committed",
      "required": true
    },
    {
      "role": "area:auth",
      "path": "orchestrator/api-contract/manifests/generation-artifacts/gen-20260813T184709Z-154b4cf21379/areas/auth.json",
      "schemaVersion": 1,
      "size": 8203,
      "hash": "sha256:024923a683a759bc588414be4e6680ee7b47c77878125cdf050b5c5ba7362a86",
      "persistence": "committed",
      "required": true
    },
    {
      "role": "area:equipments",
      "path": "orchestrator/api-contract/manifests/generation-artifacts/gen-20260813T184709Z-154b4cf21379/areas/equipments.json",
      "schemaVersion": 1,
      "size": 66,
      "hash": "sha256:195bf225a64e0311a3febf9ffeda2107f885aa19405d45c25755208cfabae09b",
      "persistence": "committed",
      "required": true
    },
    {
      "role": "area:exercise-examples",
      "path": "orchestrator/api-contract/manifests/generation-artifacts/gen-20260813T184709Z-154b4cf21379/areas/exercise-examples.json",
      "schemaVersion": 1,
      "size": 10933,
      "hash": "sha256:d7bd112bf1b9366af34a1124ca2ef27908671e2d4df594d36304680a5b9fb532",
      "persistence": "committed",
      "required": true
    },
    {
      "role": "area:exercise-metrics",
      "path": "orchestrator/api-contract/manifests/generation-artifacts/gen-20260813T184709Z-154b4cf21379/areas/exercise-metrics.json",
      "schemaVersion": 1,
      "size": 22693,
      "hash": "sha256:faa24b1ef4bf318f1b989f34bd169a65e9b1cbd4d544befe49b2a28f5e1d9920",
      "persistence": "committed",
      "required": true
    },
    {
      "role": "area:muscles",
      "path": "orchestrator/api-contract/manifests/generation-artifacts/gen-20260813T184709Z-154b4cf21379/areas/muscles.json",
      "schemaVersion": 1,
      "size": 63,
      "hash": "sha256:b2d12f3ad80caec67b921170d5bf39734d48c879360399122887a104755cf841",
      "persistence": "committed",
      "required": true
    },
    {
      "role": "area:push-tokens",
      "path": "orchestrator/api-contract/manifests/generation-artifacts/gen-20260813T184709Z-154b4cf21379/areas/push-tokens.json",
      "schemaVersion": 1,
      "size": 901,
      "hash": "sha256:12b927dbda236ae0cc8e3552b8504aa38537c2e451e904776c01e70ac806053e",
      "persistence": "committed",
      "required": true
    },
    {
      "role": "area:trainings",
      "path": "orchestrator/api-contract/manifests/generation-artifacts/gen-20260813T184709Z-154b4cf21379/areas/trainings.json",
      "schemaVersion": 1,
      "size": 14513,
      "hash": "sha256:0c694af23ce96e20fc2bc9bba86d8a596bee6cf745e5a56a659e97fc618d1b93",
      "persistence": "committed",
      "required": true
    },
    {
      "role": "area:users",
      "path": "orchestrator/api-contract/manifests/generation-artifacts/gen-20260813T184709Z-154b4cf21379/areas/users.json",
      "schemaVersion": 1,
      "size": 30639,
      "hash": "sha256:6a47f291e1227d3e5425df364580a15255ec69555d37714a4f411b5790f3b5e6",
      "persistence": "committed",
      "required": true
    },
    {
      "role": "area:weight-history",
      "path": "orchestrator/api-contract/manifests/generation-artifacts/gen-20260813T184709Z-154b4cf21379/areas/weight-history.json",
      "schemaVersion": 1,
      "size": 910,
      "hash": "sha256:39125397556196baa6eb4caa3409bc6963f25c32e1149aa9fc962bc23620114f",
      "persistence": "committed",
      "required": true
    },
    {
      "role": "change-report",
      "path": "orchestrator/.cache/api-contract/reports/change-set-edf23bb1e494b5607632ab69.json",
      "schemaVersion": 2,
      "size": 15322,
      "hash": "sha256:64e52f7c013ea3d0b7a8f5f2ddf10aa625d5d7a28bbedf5afa9c09c5ed1fa453",
      "persistence": "runtime",
      "required": false
    },
    {
      "role": "refresh-report",
      "path": "orchestrator/.cache/api-contract/reports/refresh-job-0eb6a3df134fdcf48c4d6fcd8f33674c.json",
      "schemaVersion": 1,
      "size": 680,
      "hash": "sha256:7b092e08a924726826c483056567bc054f4bbf0b9091be7c052d18eb62ff88ee",
      "persistence": "runtime",
      "required": false
    }
  ]
}
